<?xml version="1.0" standalone="yes"?>
<xs:schema 
  xmlns:msdata="urn:schemas-microsoft-com:xml-msdata" 
  xmlns:xs="http://www.w3.org/2001/XMLSchema" id="persons">
  <xs:element name="persons">
    <xs:complexType>
      <xs:choice maxOccurs="unbounded">
        <xs:element name="person">
          <xs:complexType>
            <xs:sequence>
              <xs:element name="firstname" type="xs:string"/>
              <xs:element name="lastname" type="xs:string"/>
              <xs:element name="vehicleId" type="xs:int"/>
            </xs:sequence>
            <xs:attribute name="id" type="xs:int" use="required"/>
          </xs:complexType>
        </xs:element>
        <xs:element name="vehicle">
          <xs:complexType>
            <xs:sequence>
              <xs:element name="type" type="xs:string"/>
            </xs:sequence>
            <xs:attribute name="id" type="xs:int" use="required"/>
          </xs:complexType>
        </xs:element>
      </xs:choice>
    </xs:complexType>
  </xs:element>
</xs:schema>
